{
  "schemaVersion": 2,
  "kind": "xtranslate.glossary",
  "name": "软件开发示例",
  "domain": "软件开发",
  "sourceLanguage": "en",
  "targetLanguage": "zh-CN",
  "matching": { "mode": "wholeWord", "caseSensitive": false },
  "terms": [
    { "source": "thread", "target": "线程", "preserveSource": false, "note": "软件并发上下文；这条示例不是出版社词典数据。" },
    { "source": "API", "target": "", "preserveSource": true, "note": "保留实际命中的原始拼写和大小写。" }
  ],
  "provenance": {
    "sourceName": "用户自建示例",
    "sourceUri": "",
    "license": "",
    "licenseUri": "",
    "attribution": "不包含第三方词库；空许可字段表示未指定，而不是已获得授权。",
    "sourceVersion": "1"
  },
  "revision": {
    "resourceId": "00000000000000000000000000000001",
    "number": 1,
    "createdUtc": "2026-10-16T00:00:00+00:00",
    "sourceSha256": "",
    "changeNote": "演示修订；不是实际用户导入记录。"
  }
}
